{
  "schema_version": 1,
  "enabled": false,
  "archived": true,
  "source_repository": "https://github.com/modelcontextprotocol/servers-archived",
  "source_revision": "9be4674d1ddf8c469e6461a27a337eeb65f76c2e",
  "package_name": "@modelcontextprotocol/server-gitlab",
  "package_version": "0.6.2",
  "executable": "C:/Program Files/nodejs/node.exe",
  "entry_point": "C:/Projects/.kis-mcp/providers/gitlab/node_modules/@modelcontextprotocol/server-gitlab/dist/index.js",
  "arguments": [],
  "environment_names": [
    "GITLAB_API_URL",
    "GITLAB_PERSONAL_ACCESS_TOKEN"
  ]
}
